1196	사고	1	sago	n.	accident	사고가 났어.	An accident happened.	134 | 0.88
1197	끊다		kkeunda	v.	disconnect, hang up	빨리 전화를 끊었어요.	I hung up the phone quickly.	134 | 0.76
1198	부자		buja	n.	rich	우리는 부자가 부럽지 않아요.	We are not envious of the rich.	134 | 0.53
1199	공간		gonggan	n.	space	전시를 위해서는 공간이 너무 좁군요.	The space is too narrow for the exhibition.	134 | 0.93
1200	편	1	pyeon	n.b.	side	어머니는 누구 편도 들지 않으셨어요.	My mother did not take either side.	134 | 0.92
1201	빛		bit	n.	light	그는 어둠 속의 빛처럼 환하게 빛나더구나.	He was sparkling like a light in the darkness.	134 | 0.97
1202	터지다		teojida	v.	explode	풍선이 터져 버렸어요.	The balloon exploded.	134 | 0.90
1203	떼다		tteda	v.	detach	사람들이 포스터를 떼려고 해요.	People are trying to pull the poster down.	134 | 0.86
1204	아이	2	ai	exc.	oh, ah, oh my	아이, 왜 이러니?	Oh, why do you do this?	133 | 0.17
1205	자동차		jadongcha	n.	car, automobile	삼촌이 아버지 자동차를 몰고 갔는데요.	My uncle drove my dad’s car.	133 | 0.91
1206	냥		nyang	n.b.	COUNTER (gold, silver, money in old times)	금 한 냥이 얼마지요?	How much is one nyang of gold?	133 | 0.25
1207	확인하다		hwaginhada	v.	confirm	제가 그에게 확인할 게 있어서요.	I have something to confirm with him.	133 | 0.98
1208	키우다		kiu	v.	raise, bring up, grow	그는 시골에서 소와 닭을 키운다.	He raises cows and hens in the countryside.	133 | 0.84
1209	드러나다		deureonada	v.	reveal, appear	그의 정체가 명백히 드러났다.	His identity was clearly revealed.	132 | 0.97
1210	분명하다		bunmyeonghada	a.	clear, obvious	내가 지갑을 집에 놓고 온 게 분명해.	It is obvious that I left my wallet at home.	132 | 1.00
1211	반대		bandae	n.	opposition	그들은 내 제안에 반대를 표했습니다.	They expressed opposition to my proposal.	132 | 0.93
1212	자주		jaju	adv.	frequently, often	민서는 운동을 자주 한다.	Minseo works out frequently.	132 | 0.96
1213	현재	2	hyeonjae	n.	current time, present, now	현재까지 서울에는 비가 온다.	Up to now it has been raining in Seoul.	132 | 0.89
1214	벽		byeok	n.	wall, barrier	벽에 손을 대 보세요.	Please place your hands on the wall.	132 | 0.94
1215	라고/으라고	2	rago/eurago	e.	FINAL, COMMAND	이제 일 그만하고 쉬라고.	Stop working and take a rest.	132 | 0.43
1216	뭣		mwot	pron.	what	네 손에 든 게 뭣이냐?	What’s in your hand?	132 | 0.43
1217	태어나다		taeeonada	v.	be born	나는 대전에서 태어났어.	I was born in Daejeon.	132 | 0.98
1218	벗어나다		beoseonada	v.	get out of; deviate	도시를 벗어나 교외로 가자.	Let’s escape from the city and go to the suburbs.	132 | 0.99
1219	종		jong	n.	species, kind	다윈이 종의 기원을 썼다.	Darwin wrote The Origin of Species.	132 | 0.91
1220	매		mae	n.	rod, lash	아버지는 매를 드셨어.	My father held a rod.	132 | 0.53
1221	밝다		bakda	a.	bright, light; dawn	달이 밝구나.	The moon is bright.	131 | 0.91
1222	겪다		gyeokda	v.	experience	민준은 여러 가지 일을 겪었어.	Minjun experienced a variety of things.	131 | 0.96
1223	이기다		igida	v.	win	이번 선거에는 어느 당이 이겼나요?	Which party won in this election?	131 | 0.91
1224	새로		saero	adv.	newly	주인이 직원을 새로 뽑았어.	The owner newly hired the employee.	131 | 0.90
1225	거치다		geochida	v.	go through, pass	기차가 대전을 거쳐서 서울로 와.	The train arrives in Seoul, passing through Daejeon.	131 | 0.93
1226	한편	1	hanpyeon	adv.	meanwhile	한편, 연휴에 교통사고가 많았습니다.	Meanwhile, there were lots of car accidents during the holidays.	131 | 0.78
1227	잠깐	1	jamkkan	adv.	for a moment, briefly	잠깐만 기다려 주시겠어요?	Would you please wait for a minute?	131 | 0.63
1228	장	2	jang	n.	chapter; COUNTER (chapter)	이 책은 3 장이 중요해.	Chapter 3 of this book is important.	131 | 0.83
1229	위원		wiwon	n.	member (of a committee)	여당은 다섯 명의 위원들을 선출했다.	The leading party elected five members.	131 | 0.76
1230	갖추다		gatchuda	v.	have, be equipped with	회사는 내부에 세탁실도 갖추고 있더군.	The company is equipped with laundry rooms inside.	130 | 0.93
1231	틀리다		teullida	v.	be wrong, incorrect; make a mistake	제가 틀린 건가요?	Was I wrong?	130 | 0.64
1232	넓다		neolda	a.	broad, spacious	집이 아주 넓군요.	The house is very spacious.	130 | 0.94
1233	서/이서		seo/iseo	p.case	SUBJECT MARKER	학생 둘이서 선생을 찾아갔다.	Two students visited the teacher.	130 | 0.67
1234	녀석		nyeoseok	n.b.	guy, fellow	그 녀석이 수업에 안 간 모양입니다.	That guy seems to have skipped class today.	130 | 0.77
1235	계속하다		gyesokada	v.	continue, keep (on)	그들은 연구를 계속했다.	They continued their research.	130 | 0.93
1236	쥐다		jwida	v.	hold, clench, grasp	선수가 손에 공을 쥐고 있었어요.	A player was holding a ball in his hand.	130 | 0.79
1237	주민		jumin	n.	resident	주민들이 학교 운동장에서 운동을 하네요.	The residents are exercising in the school playground.	130 | 0.86
1238	겨울		gyeoul	n.	winter	겨울에 눈이 많이 온다.	It snows a lot in the winter.	130 | 0.97
1239	딴		ttan	adn.	another, irrelevant, any other	딴 일에 정신을 팔지 마세요.	Don’t pay attention to any other matter.	130 | 0.45
1240	여섯		yeoseot	num.	six	저녁 여섯 시까지 근무합니다.	I work till 6:00 pm.	130 | 0.60
1241	언제	2	eonje	pron.	when	언제 한국에 오셨어요?	When did you come to Korea?	130 | 0.85
1242	펴다		pyeoda	v.	unfold, straighten; press out	어머니가 다리미로 바지 주름을 폈다.	Mother pressed the wrinkles out of the pants with an iron.	130 | 0.94
1243	쌓다		ssatda	v.	pile up, stack up, build	책상에 책을 쌓아 두었지.	I piled up books on the desk.	129 | 0.81
1244	영국		yeongguk	n.	Britain	영국은 신사의 나라로 통한다.	Britain is known as a kingdom of gentlemen.	129 | 0.87
1245	독일		dogil	n.	Germany	독일의 기술력은 믿기 힘들 정도야.	German technology is incredible.	129 | 0.83
1246	달리다	1	dallida	v.	run, race	지민이는 달리기 시작했다.	Jimin started to run.	129 | 0.93
1247	양	1	yang	n.	quantity, amount, volume	양보다 질이 먼저야.	The quality surpasses the quantity.	129 | 0.88
1248	알리다		allida	v.	inform, notify, report	이 소식을 모두에게 알렸다.	We informed everyone of the news.	129 | 0.98
1249	수업		sueop	n.	class, lesson	선생님은 수업 중이세요.	The teacher is in the middle of class.	129 | 0.68
1250	자고		jago	e.	CONNECTIVE, QUOT., PROPOSE	영화 보러 가자고 친구와 약속했어요.	I promised my friend to go and see a movie.	129 | 0.83
1251	사태		satae	n.	situation, state of affairs	사태가 매우 심각해요.	The situation is very serious.	129 | 0.85
1252	석	1	seok	adn.	three	운동을 석 달쯤 했어.	I did exercise for about three months.	129 | 0.46
1253	흔들다		heundeulda	v.	shake	손을 흔들면서 인사하세요.	Please shake hands while greeting.	129 | 0.81
1254	마치다		machida	v.	finish	이제 오늘 강의를 마치겠습니다.	Now I will finish today’s lecture.	129 | 0.94
1255	대답하다		daedapada	v.	answer	아이의 대답하는 목소리가 점점 작아졌어요.	The voice of the child who was answering gradually got smaller.	129 | 0.89
1256	냄새		naemsae	n.	smell	집에서 이상한 냄새가 나네.	There’s a strange smell at home.	128 | 0.89
1257	둘째		duljjae	num.	second	민지는 둘째로 태어났지요.	Minji was born second.	128 | 0.88
1258	원인		wonin	n.	reason	사고의 원인은 무엇입니까?	What’s the reason for the accident?	128 | 0.92
1259	걸치다		geolchida	v.	wear, put on; cover	손님은 값비싼 코트를 걸치고 있었어.	The customer wore an expensive coat.	128 | 0.99
1260	광고		gwanggo	n.	advertisement	회사는 광고 수익을 모두 기부했어.	The company donated all its profits from advertisements.	128 | 0.87
1261	자라다		jarada	v.	grow (up), be raised	아이는 자라서 어른이 된다.	A child grows up to be an adult.	128 | 0.93
1262	거	2	geo	pron.	thing	그런 거에 신경 쓰지 마세요.	Don’t let that sort of thing bother you.	127 | 0.18
1263	오늘날		oneullal	n.	today, present	오늘날 과학의 발전은 대단하다.	Today the advancement of science is magnificent.	127 | 0.82
1264	든지		deunji	e.	CONNECTIVE, whether … or …	네가 하든지 말든지 상관 없어.	It doesn’t matter whether you do it or not.	127 | 0.58
1265	인사	1	insa	n.	greeting, salutation	사회 생활의 기본은 인사다.	The basis of social activities is saying hello.	127 | 0.82
1266	어깨		eokkae	n.	shoulder	어깨를 좀 다쳤어.	I hurt my shoulder a little.	127 | 0.85
1267	형님		hyeongnim	n.	elder brother	형님은 개인 사업을 하십니다.	My older brother runs a private business.	127 | 0.62
1268	정권		jeonggwon	n.	regime, administration	새 정권은 법적 절차를 바꿨다.	The new regime changed the legal process.	127 | 0.87
1269	사정		sajeong	n.	circumstances, reason	서연이도 사정이 있을 거야.	Seoyeon must have some reason.	126 | 0.97
1270	낮		nat	n.	day, daytime	강아지는 낮에 잡니다.	The puppy sleeps during the day.	126 | 0.74
1271	찾아오다		chajaoda	v.	visit, drop by	누가 어머니를 찾아오셨다.	Someone visited my mother.	126 | 0.92
1272	저거		jeogeo	pron.	that, that thing	저건 뭐에 쓰는 겁니까?	What is that thing for?	126 | 0.09
1273	중간		junggan	n.	middle, center	현우가 학기 중간에 휴학을 했어.	Hyunwu took a break in the middle of the semester.	126 | 0.79
1274	프랑스		peurangseu	n.	France	프랑스는 치즈와 와인이 유명하지.	France is famous for cheese and wine.	126 | 0.82
1275	여전히		yeojeonhi	adv.	still	너는 여전히 사탕을 좋아하는구나.	You still like candies.	125 | 0.98
1276	다루다		daruda	v.	deal with, handle, treat	아버지는 말을 잘 다루세요.	My father handles the horse well.	125 | 0.93
1277	분명히		bunmyeonghi	adv.	clearly, distinctly	분명히 내가 먼저 사과했다구요.	Clearly, I apologized first.	125 | 0.89
1278	법	2	beop	n.b.	way, law	누구든지 의사 표현의 자유가 있는 법이다.	People should have freedom of speech.	125 | 0.93
1279	달리		dalli	adv.	in any other way, differently	이전과 달리 그는 상냥하게 대답했다.	He answered kindly, unlike the last time.	125 | 0.98
1280	별	1	byeol	adn.	different, unusual	미국 생활도 한국과 별 다를 바가 없군요.	American life is not unusually different from Korean life.	125 | 0.76
1281	수사		susa	n.	investigation	경찰의 수사가 오늘부터 시작된다.	The police investigation starts today.	125 | 0.71
1282	실제로		siljero	adv.	really, actually	실제로 내 나이는 스물 셋이에요.	Actually I am twenty-three years old.	125 | 0.91
1283	아다가/어다가		adaga/eodaga	e.	CONNECTIVE, while … , on …	집에 가다가 잠시 들렀어요.	I stopped by on the way home.	124 | 0.43
1284	위	2	wi	n.b.	ranking	새로운 곡은 몇 위쯤 할까요?	How will the new song rank?	124 | 0.72
1285	놓이다		noida	v.	be placed at; be relaxed	책은 책상에 놓여 있네.	The book is placed on the desk.	124 | 0.95
1286	한번		hanbeon	n.	once, one time	이거 한번 드셔 보세요.	Please try this once.	124 | 0.68
1287	가격		gagyeok	n.	price	이 제품의 가격이 내렸구나.	The price of this product went down.	124 | 0.72
1288	새벽		saebyeok	n.	dawn, daybreak	어머니는 새벽마다 기도를 하셨지요.	My mother prayed every day at daybreak.	124 | 0.92
1289	피다		pida	v.	bloom, blossom	장미가 벌써 피었더라.	The roses have already bloomed.	124 | 0.76
1290	결정		gyeoljeong	n.	decision	나는 어느 대학에 갈지 결정을 했다.	I made a decision about what school I will go to.	124 | 0.89
1291	현		hyeon	adn.	present, current	현 대통령도 그 지역 출신이야.	The current president is from that region.	124 | 0.87
1292	매다		maeda	v.	tie, tighten	그는 서둘러 넥타이를 맸다.	He tied a blue necktie in a hurry.	123 | 0.54
1293	낫다	1	natda	a.	better, superior to	신제품이 훨씬 낫다.	The new product is much better.	123 | 0.76
1294	부산		busan	n.	Busan	부산은 항구야.	Busan is a port.	123 | 0.82
1295	그동안		geudongan	n.	meanwhile, in the meantime	그동안 잘 지내셨어요?	In the meantime, how have you been?	123 | 0.86
1296	백만		baengman	num.	million	새로 나온 영화는 백만 관객을 넘겼어.	Over a million viewers watched the new movie.	123 | 0.77
1297	허리		heori	n.	waist	할아버지께서 허리를 다치셨어.	Grandfather hurt his waist.	123 | 0.82
1298	흔히		heunhi	adv.	commonly, frequently	그런 사람은 흔히 볼 수 있다.	That sort of person can be seen frequently.	123 | 0.84
1299	집다		jipda	v.	pick up	난 젓가락으로 그걸 집었어.	I picked it up with chopsticks.	123 | 0.59
1300	쓰이다		sseuida	v.	be used, serve as	학교 건설에 쓰일 자금을 모금하고 있습니다.	We are raising funds to be used to build a school.	122 | 0.86
1301	끼다	1	kkida	v.	insert (in/between); wear	손에 반지를 한 번 껴 보았어.	I tried to wear the ring on my finger.	122 | 0.71
1302	유럽		yureop	n.	Europe	저는 여름에 유럽에 가겠습니다.	I will go to Europe in the summer.	122 | 0.82
1303	당장		dangjang	n.	right now, right away	지금 당장 출발합시다.	Let’s leave right now.	122 | 0.89
1304	선수		seonsu	n.	player, athlete	내 꿈은 유명한 축구 선수가 되는 거예요.	My dream is to be a famous football player.	122 | 0.74
1305	여		yeo	n.	female, womankind	화장실이 남과 여로 구분되어 있어요.	The bathrooms are divided into male and female.	122 | 0.46
1306	건물		geonmul	n.	building	사무실이 이 건물에 있습니까?	Is your office located in this building?	122 | 0.99
1307	짧다		jjalda	a.	short	난 긴 머리를 짧게 잘랐다.	I cut my long hair short.	122 | 0.94
1308	살	2	sal	n.	flesh, skin	소녀의 살이 유난히 희다.	The girl’s skin was particularly white.	122 | 0.66
1309	증인		jeungin	n.	witness	나는 증인으로 법정에 서야 해.	I have to appear in court as a witness.	121 | 0.34
1310	마누라		manura	n.	wife (SLANG)	마누라 잔소리가 그립네.	I miss my wife’s nagging.	121 | 0.44
1311	점점		jeomjeom	adv.	gradually, by degree	아이는 점점 자라서 어른이 된다.	A child gradually grows up and becomes an adult.	121 | 0.89
1312	잘못	1	jalmot	adv.	wrong, mistakenly	부모가 잘못 행동한 거야.	The parents behaved wrongly.	121 | 0.72
1313	중앙		jungang	n.	center, middle	길 중앙에 차를 세웠다.	I parked the car in the middle of the road.	121 | 0.88
1314	바쁘다		bappeu	a.	busy	요즘 바쁘시죠?	Aren’t you busy these days?	121 | 0.85
1315	똑같다		ttokgatda	a.	same, identical	쌍둥이는 똑같이 생겼어.	The twins look identical.	121 | 0.73
1316	전통		jeontong	n.	tradition	한국 사회는 문화와 전통을 소중하게 생각해.	The Korean society values its culture and traditions.	121 | 0.85
1317	화		hwa	n.	anger	현우는 솟구치는 화를 참았어.	Hyunwu suppressed a burst of anger.	121 | 0.84
1318	경기	1	gyeonggi	n.	game, match, event	이번 경기에서 나는 우승하고 싶다.	I’d like to win this game.	121 | 0.62
1319	미리		miri	adv.	in advance	사람들은 돈을 미리 냈습니다.	People paid in advance.	120 | 0.90
1320	건설		geonseol	n.	construction	올해에는 아파트 건설이 상당히 줄었어요.	Apartment construction decreased this year.	120 | 0.76
1321	규모		gyumo	n.	size	어떤 규모의 이벤트를 기획하세요?	What size event are you planning?	120 | 0.75
1322	냐면		nyamyeon	e.	CONNECTIVE, EXPLAIN	내가 왜 이러냐면 네가 좋아서야.	The reason why I am doing this is because I like you.	120 | 0.08
1323	위기		wigi	n.	crisis	위기의 순간에도 침착하세요.	Stay calm in a moment of crisis.	120 | 0.81
1324	발표하다		balpyohada	v.	announce, present	그들은 결혼을 발표했다.	They announced their marriage.	120 | 0.77
1325	그룹		geurup	n.	group	그 수업은 그룹 프로젝트를 포함하고 있어.	That course includes group projects.	120 | 0.78
1326	인식		insik	n.	awareness, realization	환경 문제에 대한 인식이 좀 부족해요.	Awareness of environmental issues is still insufficient.	120 | 0.87
1327	알아보다		araboda	v.	investigate, search; recognize	온라인으로 표를 알아보세요.	Search for tickets online.	120 | 0.95
1328	시설		siseol	n.	facility	학교 시설이 좋아졌어요.	The school facility was improved.	120 | 0.76
1329	차지하다		chajihada	v.	occupy, take possession, win	야당이 다수를 차지하고 있어.	The opposition party occupies the majority.	120 | 0.91
1330	얼른		eolleun	adv.	quickly	얼른 이리 와 보세요.	Please come here quickly.	119 | 0.66
1331	소식		sosik	n.	news	변호사에게 그 소식을 들었어.	I heard the news from the lawyer.	119 | 0.96
1332	덕		deok	n.	virtue	윗사람은 덕을 갖추어야 한다.	The elders should be virtuous.	119 | 0.70
1333	각각		gakgak	adv.	each	각각의 학생들이 답을 적어 냈습니다.	Each student submitted answers.	119 | 0.84
1334	지식		jisik	n.	knowledge	의문은 지식의 열쇠입니다.	Questions are the keys of knowledge.	119 | 0.86
1335	혹시		hoksi	adv.	by any chance	혹시 그가 돌아올까?	Will he come back by any chance?	119 | 0.73
1336	재미있다		jaemiitda	a.	amusing, interesting	영화가 너무 재미있어요.	The movie is very amusing.	119 | 0.79
1337	남북		nambuk	n.	south and north	나라가 남북으로 나뉘었다.	The country has been divided into south and north.	119 | 0.75
1338	혁명		hyeongmyeong	n.	revolution	과학의 혁명은 인간의 삶에 엄청난 혜택을 제공했다.	The scientific revolution had incredible benefits for human life.	119 | 0.87
1339	앞서다		apseoda	v.	get ahead, outpace	선배들은 나를 앞섰다.	The seniors got ahead of me.	119 | 0.93
1340	고만		goman	adv.	that much, to that extent	고만하면 괜찮아.	If it’s that much, it’s fine.	118 | 0.15
1341	상대		sangdae	n.	facing, confronting; opponent; company	지훈은 그의 상대가 못 된다.	Jihun can’t be his opponent.	118 | 0.96
1342	글쎄		geulsse	exc.	well	글쎄, 왜 그럴까?	Well, why is it like that?	118 | 0.54
1343	형식		hyeongsik	n.	form; formality, convention	나는 형식에 매이는 걸 좋아하지 않아요.	I don’t like being restricted by formality.	118 | 0.90
1344	대책		daechaek	n.	measure, countermeasure	비상 대책이 마련되어 있나요?	Are emergency measures prepared?	118 | 0.73
1345	결코		gyeolko	adv.	never	결코 너를 용서하지 않을 거야.	I will never forgive you.	118 | 0.98
1346	미치다	1	michida	v.	go crazy, be out of one’s mind	제가 미쳤나봐요.	I may have gone crazy.	118 | 0.72
1347	권		gwon	n.b.	COUNTER (book)	책을 몇 권 사셨습니까?	How many books have you bought?	117 | 0.93
1348	현장		hyeonjang	n.	site, scene, actual place	기자가 사건 현장에 도착했습니다.	The reporter arrived at the site of the incident.	117 | 0.93
1349	언제나		eonjena	adv.	always	민서는 항상 바쁘구나.	Minseo is always busy.	117 | 0.96
1350	누르다		nureuda	v.	press, push	서비스가 필요하시면 이 버튼을 누르세요.	If you need any service, please press this button.	117 | 0.85
1351	아부지		abuji	n.	father (COLLOQUIAL)	아부지, 어디 가세요?	Dad, where are you going?	117 | 0.26
1352	조	1	jo	num.	trillion	일 년 예산이 2조 원 정도 됩니다.	The annual budget is about two trillion won.	117 | 0.79
1353	목표		mokpyo	n.	goal	인생의 목표가 있으세요?	Do you have a goal in life?	117 | 0.89
1354	흘리다		heulrida	v.	spill, shed	많은 사람이 눈물을 흘렸다.	Many people shed tears.	117 | 0.93
1355	맨		maen	adn.	top; very	그는 맨 앞줄에 서 있었다.	He stood in the very front row.	116 | 0.66
1356	출신		chulsin	n.	of …; coming from …	시장은 부산 출신입니다.	The mayor is from Busan.	116 | 0.86
1357	떠오르다		tteooreuda	v.	occur, think of	저는 답이 떠오르지 않아요.	I can’t think of the answer.	116 | 0.93
1358	위원장		wiwonjang	n.	chairperson	의원들은 위원장을 선출했다.	The members elected the chairperson.	115 | 0.69
1359	종이		jongi	n.	paper	종이 위에 그린 그림이 특이하네.	The picture on the paper is unique.	115 | 0.82
1360	며느리		myeoneuri	n.	daughter-in-law	며느리가 온다.	The new daughter-in-law is coming.	115 | 0.58
1361	멈추다		meomchuda	v.	stop, cease	버스가 어디쯤에서 멈추나요?	Where does the bus stop?	115 | 0.86
1362	귀신		gwisin	n.	ghost	난 귀신에 홀린 듯했어.	I felt like I was possessed by a ghost.	115 | 0.58
1363	멀리		meolli	adv.	far (away)	우리 가족은 멀리 있어요.	My family is far away.	115 | 0.90
1364	단	2	dan	adn.	only	나의 단 하나의 소원은 남북통일이다.	My only wish is unification of the south and north.	115 | 0.94
1365	꼴		kkol	n.	look, appearance, sight	그는 꼴이 초라했어.	He looked shabby.	115 | 0.83
1366	불구하다		bulguhada	v.	disregard, be not deterred	어려운 환경에도 불구하고 난 대학에 갔어요.	In spite of a difficult situation, I went to college.	115 | 0.96
1367	버스		beoseu	n.	bus	버스를 타고 학교에 다녀요?	Are you commuting to school by bus?	115 | 0.95
1368	권력		gwollyeok	n.	power, authority	새로운 당이 권력을 잡았다.	The new political party came to power.	115 | 0.89
1369	나머지		nameoji	n.	rest, remainder	원금을 뺀 나머지는 얼마나 돼요?	How much is the remainder excluding the original amount?	115 | 0.95
1370	에이		ei	exc.	eh, what	에이, 그건 사실이 아니지.	Eh, that’s not a fact.	115 | 0.22
1371	자세		jase	n.	posture; attitude	그는 자세가 바르지 않아.	He doesn’t have straight posture.	114 | 0.98
1372	심다		simda	v.	plant	어디에 나무를 심고 싶으십니까?	Where do you want to plant trees?	114 | 0.82
1373	도로	1	doro	n.	road	차들이 도로에 쭉 늘어서 있네요.	Cars are lined up on the road.	114 | 0.88
1374	희다		huida	a.	white, fair	지훈이는 피부가 희구나.	Jihun has fair skin.	114 | 0.88
1375	다고	2	dago	e.	FINAL, EMPHASIS	내가 문을 잠갔다고.	I closed the door.	114 | 0.43
1376	이어지다		ieojida	v.	be connected; continue	선생님 말씀이 끝없이 이어졌어.	The teacher’s speech continued endlessly.	114 | 0.96
1377	살펴보다		salpyeoboda	v.	examine, look into	그는 집안 분위기를 살펴보았다.	He examined the atmosphere at home.	114 | 0.93
1378	노동자		nodongja	n.	worker, laborer	노동자의 권리는 보호받아야 한다.	The rights of workers must be protected.	114 | 0.94
1379	주위		juwi	n.	surrounding	주위를 잘 살펴보십시오.	Look at the surroundings carefully.	114 | 0.96
1380	방안		bangan	n.	way, measure, plan	그들은 구체적 방안을 찾고 있다.	They are looking for a specific measure.	114 | 0.73
1381	부부		bubu	n.	couple, husband and wife	그들은 마침내 부부가 되었습니다.	They finally became a married couple.	114 | 0.95
1382	일어서다		ireoseoda	v.	stand up	모든 사람이 일어섰다.	Everyone stood up.	114 | 0.75
1383	해	2	hae	n.b.	COUNTER (year)	나는 그 해에 미국을 갔지.	I went to the USA that year.	114 | 0.84
1384	피우다		piuda	v.	bloom; light, burn; smoke	봄이 오자 정원의 장미도 꽃을 피웠다.	When spring came, the roses in the garden bloomed.	113 | 0.89
1385	말	2	mal	n.b.	end (of)	정부가 이달 말에 정책을 발표할 겁니다.	The government will announce the policy at the end of this month.	113 | 0.80
1386	미안하다		mianhada	a.	sorry	늦어서 정말 미안합니다.	I’m s. sorry for being late.	113 | 0.72
1387	북	1	buk	n.	north	나침반 바늘이 북을 가리킨다.	A compass needle is pointing out the north.	113 | 0.75
1388	신랑		sillang	n.	bridegroom	신랑이 먼저 입장을 합니다.	The bridegroom will enter first.	113 | 0.50
1389	분석		bunseok	n.	analysis	자료 분석은 정확하게 이뤄졌다.	The data analysis was accurately done.	113 | 0.83
1390	넘기다		neomgida	v.	pass … over; flip	나는 책장만 넘기고 있었어.	I was just flipping through the book.	113 | 0.93
1391	알		al	n.	egg, spawn	알에서 병아리가 나오는구나.	A chick comes out of an egg.	113 | 0.70
1392	쏘다		ssoda	v.	shoot, fire	한국인들은 활을 잘 쏘는 민족이었어.	Koreans were a people who shot arrows well.	113 | 0.73
1393	바위		bawi	n.	rock	사람들이 바위 위에 서 있다.	People are standing on top of the rock.	113 | 0.78
1394	기록		girok	n.	record	사건의 기록이 없어졌다.	The record of the incident is missing.	113 | 0.89
1395	쫓다		jjotda	v.	chase, run after	경찰이 용의자를 쫓고 있지요.	The police are chasing the suspect.	112 | 0.56
1396	가져오다		gajeoo	v.	bring	무관심이 비극을 가져왔다.	Indifference brought on the tragedy.	112 | 0.92
1397	그곳		geugot	pron.	there, that place	그곳은 벌써 덥다.	It is already hot there.	112 | 0.91
1398	눈치		nunchi	n.	sense, notice	친구는 내 상태를 이미 눈치 챘어.	My friend already noticed the state I was in.	112 | 0.85
1399	실제		silje	n.	truth, reality; practical	실제 수익을 따져봅시다.	Let’s calculate the practical gain.	112 | 0.89
