3636	자랑하다		jaranghada	v.	boast, brag	어머니는 항상 남들에게 나를 자랑하셨어요.	My mother always boasted about me to others.	34 | 0.96
3637	비평		bipyeong	n.	criticism, review	영화 비평을 봤습니까?	Did you read the movie review?	34 | 0.78
3638	업종		eopjong	n.	type of business	자기에게 맞는 업종을 찾아보세요.	Find the type of business that fits you.	34 | 0.65
3639	서부터		seobuteo	p.case	from	어디서부터 잘못된 걸까?	Where did it go wrong?	34 | 0.70
3640	범인		beomin	n.	criminal, culprit	범인은 잡혔다.	The criminal got caught.	34 | 0.98
3641	끌리다		kkeullida	v.	drag; be attracted to	바지가 땅에 끌려.	My pants are dragging on the floor.	34 | 0.88
3642	잘나다		jallada	a.	good, distinguished	그의 아들은 참 잘났어.	His son is so good.	34 | 0.68
3643	부하		buha	n.	subordinate, person under one’s charge	부하는 상관의 지시에 따라야 합니다.	The subordinate must follow the superior’s command.	34 | 0.96
3644	후기		hugi	n.	latter part	민서는 조선 시대 후기를 연구하고 있습니다.	Minseo is studying the latter part of the Joseon period.	34 | 0.69
3645	헤매다		hemaeda	v.	wander, roam; get confused	강아지가 길을 헤메고 다닌다.	A puppy is wandering around the street.	34 | 0.95
3646	한테서		hanteseo	p.case	from	내가 너한테서 배운 거야.	I learned it from you.	34 | 0.79
3647	활용		hwaryong	n.	utilization, application	자원 활용이 잘 되어야지.	Resource utilization must be well done.	34 | 0.73
3648	바늘		baneul	n.	needle	바늘이 부러졌어요.	The needle got broken.	34 | 0.82
3649	누이		nui	n.	sister	어느 날 누이동생에게 전화가 왔지.	One day, my younger sister called.	34 | 0.76
3650	우연히		uyeonhi	adv.	by chance, by accident	우연히 길에서 친구를 만났어.	I met a friend on the street by chance.	34 | 0.96
3651	허공		heogong	n.	air, void	나는 허공에 소리를 질렀다.	I yelled into the air.	34 | 0.80
3652	합리적		hamnijeok	n.	reasonable, rational	가격이 합리적이지 않군요.	The price is not reasonable.	34 | 0.87
3653	총회		chonghoe	n.	general meeting	총회가 다음 주에 열릴 예정입니다.	The general meeting is scheduled to be held next week.	34 | 0.81
3654	물고기		mulgogi	n.	fish			
3655	거부		geobu	n.	refusal, rejection	그건 거부를 뜻하는 거 아냐?	That means rejection, doesn’t it?	34 | 0.87
3656	격		gyeok	n.b.	standing, class, status	이 호텔은 다른 곳과는 격이 달라.	This hotel is different from others in terms of class.	34 | 0.98
3657	비서		biseo	n.	secretary, assistant	비서가 우리에게 연락을 했어.	The secretary contacted us.	34 | 0.83
3658	비비다		bibida	v.	rub, scrub; mix	옷을 손으로 비볐어요.	I scrubbed the clothes by hand.	34 | 0.79
3659	썰다		sseolda	v.	cut, chop, slice	요리사는 고기를 썰었다.	The chef cut meat.	34 | 0.81
3660	의존하다		uijonhada	v.	depend on, rely on	남에게 너무 의존하면 안 돼.	You shouldn’t depend on others too much.	33 | 0.82
3661	거느리다		geoneurida	v.	have; command	장군은 수 백 명의 부하를 거느리고 있었다.	The general had hundreds of subordinates.	33 | 0.92
3662	펼쳐지다		pyeolcheojida	v.	unfold, spread; be held	놀라운 광경이 앞에 펼쳐졌다.	An incredible scene unfolded in front of me.	33 | 0.95
3663	부인하다		buinhada	v.	deny, repudiate	사실을 부인할 수는 없지.	You can’t deny the fact.	33 | 0.94
3664	거니와		geoniwa	e.	CONNECTIVE, as well as	휴가 때는 날씨도 덥거니와 교통도 복잡해.	During the holidays, as well as the traffic being busy, the weather is hot.	33 | 0.93
3665	차다	3	chada	v.	wear, put on	주인이 비싼 시계를 차고 있어.	The owner wears an expensive watch.	33 | 0.77
3666	빠져나가다		ppajeonagada	v.	get out, escape	몸에서 모든 힘이 빠져나가는 듯했어.	I felt like all the energy drained out of my body.	33 | 0.90
3667	햇살		haetsal	n.	sunlight, sunshine	햇살이 너무 따갑다.	The sunshine is too hot.	33 | 0.82
3668	아울러		aulleo	adv.	in addition, together	아울러 이 일은 비밀입니다.	In addition, this is a secret.	33 | 0.86
3669	느니		neuni	e.	CONNECTIVE, rather than	여기서 자느니 바깥에서 잘 거야.	I will sleep outside rather than sleep here.	33 | 0.81
3670	풍기다		punggida	v.	smell; give off, exude	그녀의 향수 냄새가 방 안에 진하게 풍겼다.	Her perfume overpowered the room.	33 | 0.91
3671	확보		hwakbo	n.	securement	우리는 충분한 자금을 확보했다.	We secured enough funding.	33 | 0.73
3672	토하다		tohada	v.	vomit, throw up	아기가 갑자기 토했어요.	The baby vomited all of a sudden.	33 | 0.89
3673	프로	2	peuro	n.	program	어떤 프로를 보세요?	What kind of program do you watch?	33 | 0.73
3674	맞이하다		majihada	v.	receive, greet	주인이 문 앞에서 손님을 맞이했다.	The owner greeted a customer in front of the door.	33 | 0.97
3675	근심		geunsim	n.	worry, concern	요즘 뭐 근심이 있으세요?	Do you have concerns these days?	33 | 0.63
3676	육체		yukche	n.	body, physical	지훈이는 육체 노동을 싫어해.	Jihun hates physical labor.	33 | 0.92
3677	확대하다		hwakdaehada	v.	expand, enlarge	프로젝트를 좀 더 확대할 생각이야.	I am thinking of expanding the project more.	33 | 0.77
3678	결혼식		gyeolhonsik	n.	wedding ceremony	결혼식은 언제야?	When is the wedding ceremony?	33 | 0.86
3679	보상		bosang	n.	indemnification, compensation	그는 정신적 피해에 대한 보상을 요구했다.	He requested compensation for the psychological damage.	33 | 0.89
3680	전반적		jeonbanjeok	n.	overall, general	전반적으로 좋은 경기였어.	Overall, it was a good game.	33 | 0.82
3681	차츰		chacheum	adv.	gradually, slowly	차츰 내 생활도 안정이 되어갔다.	My life gradually settled down.	33 | 0.95
3682	일기		ilgi	n.	diary, journal	지민이는 일기를 쓴다.	Jimin keeps a diary.	33 | 0.95
3683	감시		gamsi	n.	surveillance, vigilance	우리는 감시를 당하고 있었어.	We were under surveillance.	33 | 0.91
3684	만주		manju	n.	Manchuria	그는 만주에서 활동했던 적이 있어.	He had experience working in Manchuria.	33 | 0.89
3685	자세하다		jasehada	a.	detailed, minute	자세한 내용은 저도 몰라요.	I don’t know the detailed content.	33 | 0.90
3686	채다		chaeda	v.	sense, notice	눈치를 채셨어요?	Did you get the notice?	33 | 0.81
3687	숙제		sukje	n.	homework, assignment	숙제를 다 했니?	Are you done with your homework?	33 | 0.87
3688	오리		ori	n.	duck	오리들이 산책을 나왔구나.	Ducks came out for a walk.	33 | 0.68
3689	구입하다		guipada	v.	purchase	나는 핸드폰을 새로 구입했다.	I purchased a new cellphone.	33 | 0.82
3690	보고하다		bogohada	v.	report, inform	비서가 뭔가를 보고했어.	The secretary reported something.	33 | 0.96
3691	여간		yeogan	adv.	common, ordinary (with a negative word)	애가 여간 똑똑한 게 아니야.	The child is really smart.	33 | 0.87
3692	만족하다		manjokada	a.	be satisfied (with), be content (with)	그 성과에 모두가 만족했다.	Everyone was satisfied with the achievement.	33 | 0.98
3693	출발		chulbal	n.	departure	출발이 몇 시입니까?	What time is the departure?	33 | 0.95
3694	체		che	n.b.	pretense	그는 못 듣는 체해요.	He makes a pretense of not listening.	33 | 0.80
3695	채권		chaegwon	n.	bond	채권의 이율이 아주 높아요.	The bond interest is very high.	33 | 0.58
3696	법칙		beopchik	n.	law, rule	모든 법칙에는 예외가 있지요.	Every law has some exception.	33 | 0.64
3697	제국		jeguk	n.	empire	제국은 서서히 무너졌다.	The empire slowly collapsed.	33 | 0.88
3698	호흡		hoheup	n.	breath, breathing, respiration	환자는 호흡이 불안정했다.	The patient’s breathing was unstable.	33 | 0.99
3699	자신	2	jasin	n.	self-confidence, self-assurance	자신 있습니까?	Do you have self-confidence?	33 | 0.92
3700	어음		eoeum	n.	promissory note	오늘 어음을 결제해요.	We pay the promissory note today.	33 | 0.86
3701	인수		insu	n.	takeover, transfer	가게 인수가 무사히 끝났다.	The takeover of a company has been safely done.	33 | 0.69
3702	보름		boreum	n.	fifteen days, half month; the fifteenth day of a month	이달 보름에 모두 만납시다.	Let’s all meet on the fifteenth of this month.	33 | 0.81
3703	얼음		eoreum	n.	ice	물이 얼음이 되었다.	Water became ice.	33 | 0.95
3704	부치다		buchida	v.	send, dispatch	부모님께 카드를 부쳤어요.	I sent a card to my parents.	33 | 0.79
3705	장비		jangbi	n.	equipment	장비를 챙겨라.	Take all the equipment.	33 | 0.77
3706	안주		anju	n.	bar snacks	안주가 빠지면 안 되지.	We cannot miss having bar snacks.	33 | 0.67
3707	협의회		hyeopih	n.	committee	학교 폭력을 논의하기 위한 협의회가 구성되었다.	A committee to discuss school violence has been organized.	33 | 0.61
3708	수화기		suhwagi	n.	receiver	수화기를 할머니께 가져다 드렸어.	I brought the receiver to my grandma.	33 | 0.66
3709	문헌		munheon	n.	literature	그 문헌에는 역사적 사실들이 기록되어 있었다.	In the literature, historical facts were recorded.	33 | 0.72
3710	여태		yeotae	adv.	still, so far	여태 아무것도 안 했니?	Have you done nothing so far?	33 | 0.60
3711	발길		balgil	n.	walk, steps; coming and going	현우는 거기로 발길을 돌렸다.	Hyunwu turned his steps in that direction.	33 | 0.91
3712	의심하다		uisimhada	v.	doubt, suspect	주인은 직원을 의심했다.	The owner suspected an employee.	33 | 0.99
3713	거절하다		geojeolhada	v.	refuse, rebuff, reject	그런 부탁은 거절하고 싶습니다.	I want to refuse that kind of favor.	33 | 0.99
3714	성인		seongin	n.	adult	민서도 이제 성인이 되었구나.	Minseo has now become an adult.	33 | 0.92
3715	예상하다		yesanghada	v.	expect, anticipate	난 그의 반응을 예상했었어요.	I anticipated his reaction.	33 | 0.93
3716	녀		nyeo	n.b.	COUNTER (daughter)	그는 1남 2녀를 두고 있다.	He has one son and two daughters.	33 | 0.81
3717	정월		jeongwol	n.	first month of the year	정월에 결혼식이 있어요.	There is a wedding in January.	33 | 0.69
3718	바닷가		badatga	n.	seashore, seaside, beach	바닷가에 놀러 가자.	Let’s go to play at the seashore.	33 | 0.88
3719	개성		gaeseong	n.	individuality, personality	배우마다 개성이 있어.	Each actor has personality.	33 | 0.91
3720	총무		chongmu	n.	manager	민서가 총무를 맡고 있어.	Minseo is in charge of a manager.	33 | 0.72
3721	각기		gakgi	adv.	respectively, each	각기 자기 일에 열중하기로 했다.	They each decided to focus on their own work.	33 | 0.93
3722	전개되다		jeongaedoeda	v.	unfold, develop	이야기는 흥미롭게 전개되었다.	The story was unfolding interestingly.	33 | 0.85
3723	햇빛		haetbit	n.	sun, sunlight	햇빛이 강한 날이다.	It is a day with strong sunlight.	33 | 0.96
3724	주도하다		judohada	v.	lead, take the lead	회의는 의장이 주도합니다.	The chair will preside over the meeting.	33 | 0.81
3725	빌딩		bilding	n.	building	빌딩이 멀리 보였다.	The building is visible over there.	33 | 0.91
3726	당사자		dangsaja	n.	person directly concerned, person in question	그 질문은 당사자에게 물어 보세요.	Ask that question to the person directly concerned.	33 | 0.91
3727	사찰		sachal	n.	investigation, inspection	정부 기관의 사찰이 있을 겁니다.	There will be an investigation by a government body.	33 | 0.69
3728	진상		jinsang	n.	truth, reality	사건의 진상이 밝혀질 겁니다.	The truth of the accident will be revealed.	33 | 0.79
3729	에미		emi	n.	mother (LOWERING)	네 에미가 누구니?	Who is your mother?	33 | 0.63
3730	탈		tal	n.	accident, incident; trouble, hindrance	너무 똑똑해도 탈이네.	It is troublesome to be too smart.	33 | 0.89
3731	다수		dasu	n.	majority	다수의 관중이 박수를 쳤다.	The majority of the audience applauded.	33 | 0.87
3732	해당		haedang	n.	correspondence, relevance	해당 병원들은 한동안 문을 닫았다.	The corresponding hospitals were closed for a while.	33 | 0.77
3733	평범하다		pyeongbeomhada	a.	ordinary, common	지훈이는 평범한 학생이다.	Jihun is an ordinary student.	33 | 1.00
3734	낮추다		natchuda	v.	lower, reduce, bring down	그는 목소리를 낮추었다.	He lowered his voice.	33 | 0.91
3735	헤아리다		hearida	v.	count (up); understand, figure	그 땐 부모님의 마음을 헤아리지 못했어요.	I didn’t understand my parents’ minds back then.	33 | 0.98
3736	말없이		mareopsi	adv.	silently, without a word	어머니는 말없이 나를 바라보셨어.	My mother looked at me without a word.	33 | 0.78
3737	차다	4	chada	a.	cold, icy, freezing	물이 얼음처럼 차네.	The water is ice cold	33 | 0.84
3738	상당		sangdang	n.	considerable, sizeable	상당 수의 사람들에게 문의 전화가 왔다.	A considerable number of people called.	33 | 0.79
3739	정식		jeongsik	n.	formal, legal	지민은 정식으로 사원이 되었다.	Jimin became an employee legally.	33 | 0.94
3740	적용하다		jeogyonghada	v.	apply to	그 규칙은 모두에게 적용된다.	The rule applies to everyone.	33 | 0.80
3741	뭉치다		mungchida	v.	get together, unite	친구들과 자주 뭉쳐 놀았지.	I often got together with my friend and played.	33 | 0.81
3742	촉구하다		chokguhada	v.	urge, press, demand	사람들은 사건의 재조사를 촉구하고 있다.	People are urging a reinvestigation of the incident.	33 | 0.53
3743	님	2	nim	n.b.	Mr., Miss, Ms, Mrs.; ADDRESS (HONORIFIC)	김민준 님, 조금 기다려 주세요.	Mr. Minjun Kim, please wait a minute.	33 | 0.67
3744	지난번		jinanbeon	n.	last (time), the other day	지난번 회의 때 결정된 사항이다.	It’s the item decided on in the last meeting.	33 | 0.81
3745	명칭		myeongching	n.	name, title	새로운 부서의 명칭이 뭡니까?	What is the title of the new department?	33 | 0.86
3746	조국		joguk	n.	homeland	군인들은 조국을 위해 싸웠다.	The soldiers fought for their homeland.	32 | 0.97
3747	저자		jeoja	n.	writer, author	이 책의 저자를 만나 봤습니까?	Have you met with the writer of this book?	32 | 0.92
3748	대안		daean	n.	alternative	마땅한 대안이 없어.	There is no appropriate alternative.	32 | 0.84
3749	높이	2	nopi	n.	height	현우가 책상의 높이를 쟀어.	Hyunwu measured the height of the desk.	32 | 0.96
3750	합의하다		habuihada	v.	reach an agreement	두 사람은 조금씩 양보하기로 합의했어.	The two people agreed to yield a little.	32 | 0.64
3751	제조		jejo	n.	manufacturing, production	그들은 제조 기술에서 우리를 앞선다.	They are ahead of us in manufacturing skills.	32 | 0.70
3752	무리	2	muri	n.	group, crowd, party	기자들이 무리를 지어 몰려들었다.	The reporters formed a group and flocked together.	32 | 0.95
3753	허용하다		heoyonghada	v.	allow	이곳에는 주차를 허용할 수 없다.	We can’t allow parking here.	32 | 0.76
3754	띄우다		ttuiuda	v.	fly, float	아이들은 물에 종이배를 띄웠어요.	Children floated a paper boat on the water.	32 | 0.82
3755	연속		yeonsok	n.	continuation	사흘 연속 비가 내리고 있습니다.	It has been raining for three consecutive days.	32 | 0.79
3756	아무렇다		amureotda	a.	indifferent, unconcerned, fine (with a negative predicate)	난 아무렇지도 않게 말했다.	I simply said so.	32 | 0.82
3757	휴가		hyuga	n.	holiday, vacation	휴가가 언제부터니?	When does your vacation start?	32 | 0.89
3758	민족주의		minjokjuui	n.	nationalism	극단적 민족주의는 옳지 않아요.	Extreme nationalism is not right.	32 | 0.79
3759	희생		huisaeng	n.	sacrifice	자식은 부모의 희생을 원하지 않았어.	The child didn’t want his parents to make sacrifices.	32 | 0.98
3760	흘러가다		heulleogada	v.	flow, run	이야기가 이상하게 흘러가네.	The story flows strangely.	32 | 0.93
3761	벌	2	beol	n.b.	COUNTER (clothing)	옷이 몇 벌 없어.	I have a few pairs of clothing.	32 | 0.70
3762	막내		mangnae	n.	last born, youngest child	막내가 작년에 태어났지.	The youngest child was born last year.	32 | 0.78
3763	열쇠		yeolsoe	n.	keys	소녀는 열쇠를 찾고 있었다.	The girl was looking for a key.	32 | 0.94
3764	뺨		ppyam	n.	cheek	민서는 뺨이 빨개졌다.	Minseo’s cheeks turned red.	32 | 0.80
3765	베풀다		bepulda	v.	give, do . . . a favor; have mercy (on)	선생님께서는 제게 많은 은혜를 베푸셨습니다.	My teacher did me many favors.	32 | 0.96
3766	설립		seollip	n.	establishment	우리는 재단 설립을 추진하고 있어요.	We are moving forward with the establishment of a foundation.	32 | 0.75
3767	포함		poham	n.	inclusion	그건 세금 포함 가격입니다.	That is the price including the tax.	32 | 0.75
3768	동원하다		dongwonhada	v.	mobilize	회사는 추가 인력을 동원했다.	The company mobilized their extra workforce.	32 | 0.93
3769	기여하다		giyeohada	v.	contribute	나라 발전에 기여하고 싶습니다.	I would like to contribute to the development of the country.	32 | 0.84
3770	행동하다		haengdonghada	v.	behave	아이들 앞에서 침착하게 행동하세요.	Behave calmly in front of children.	32 | 0.96
3771	화살		hwasal	n.	arrow	화살은 멀리 날아갔다.	The arrow flew far away.	32 | 0.81
3772	더라면		deoramyeon	e.	CONNECTIVE, if	내가 현명했더라면 그런 일을 없었을 거야.	If I were wise, it wouldn’t happen.	32 | 0.97
3773	건만		geonman	e.	CONNECTIVE, although	그렇게 얘기했건만 왜 못 고치니?	I’ve told you many times to do so, so why don’t you break your bad habits?	32 | 0.91
3774	강하다	2	ganghada	a.	strong, powerful; mighty	적은 매우 강하다.	The enemy is very strong.	32 | 0.95
3775	자랑		jarang	n.	boast, bragging	친구는 자랑을 멈추지 않는다.	My friend never stops bragging.	32 | 0.86
3776	이내	2	inae	n.	within, no less than	아이는 오 분 이내 잠이 들었다.	The child fell asleep within five minutes.	32 | 0.83
3777	소파		sopa	n.	sofa	소파가 편안해요.	The sofa is comfortable.	32 | 0.77
3778	향기		hyanggi	n.	scent, fragrance	꽃은 향기가 있어요.	Flowers have fragrance.	32 | 0.98
3779	질리다		jillida	v.	be frightened; be sick of	이 음악은 이제 질린다.	I am sick of this music now.	32 | 0.78
3780	목욕		mogyok	n.	bath, shower	난 목욕을 서둘러 했어.	I quickly took a bath.	32 | 0.86
3781	사망		samang	n.	death, passing	나는 그의 사망을 모르고 있었다.	I didn’t know about his death.	32 | 0.82
3782	고민하다		gominhada	v.	worry, be troubled	우리는 같이 그 문제를 고민했다.	We worried about the problem together.	32 | 0.89
3783	수비		subi	n.	defense	상대팀의 수비는 강해.	The other team’s defense is strong.	32 | 0.59
3784	내려놓다		naeryeonotda	v.	put down	나는 짐을 내려놓았어요.	I put down the baggage.	32 | 0.72
3785	볼		bol	n.	cheek	아기 볼이 부드러워.	The baby’s cheeks are soft.	32 | 0.86
3786	감안하다		gamanhada	v.	consider	여러 가지 상황을 감안해서 결정하세요.	Make your decision by considering various situations.	32 | 0.74
3787	정치권		jeongchigwon	n.	political circle	정치권에서 불평이 나오기 시작했다.	The complaints started to come from political circles.	32 | 0.51
3788	개국		gaeguk	n.b.	COUNTER (number of nations)	재난 후 오십여 개국에서 구조대를 보내왔다.	After the disaster, over fifty nations sent their rescue teams.	32 | 0.67
3789	농부		nongbu	n.	farmer, peasant	농부가 들에 서 있었다.	A farmer stands in the field.	32 | 0.88
3790	합		hap	n.	sum	이 두 숫자의 합이 얼마입니까?	What is the sum of these two numbers?	32 | 0.63
3791	둥글다		dunggeulda	a.	round, spherical	아기 얼굴이 둥글어요.	The baby’s face is round.	32 | 0.91
3792	등등		deungdeung	n.b.	et cetera, and so forth	연금, 복지 등등의 문제가 논의되었다.	The issues of pension, welfare, etc., have been discussed.	32 | 0.92
3793	실적		siljeok	n.	result, performance	이번 달 우리 부서 실적이 향상됐다.	The performance of our department has improved this month.	32 | 0.64
3794	꼼짝		kkomjjak	adv.	budging, stirring	아이는 자리에서 꼼짝을 안해.	The child did not budge from his place.	32 | 0.72
3795	두려움		duryeoum	n.	fear, fright	나는 설명하기 힘든 두려움을 느꼈다.	I felt some inexplicable fear.	32 | 0.97
3796	손목		sonmok	n.	wrist	손목이 아주 가늘구나.	Your wrist is so thin.	32 | 0.75
3797	서		seo	n.	west	당시 독일은 동과 서로 나뉘어 있었어.	Germany was divided into the east and the west at that time.	32 | 0.88
3798	임원		imwon	n.	executive, board member	아버지는 회사 임원이었다.	My father was the executive of the company.	32 | 0.71
3799	도로	2	doro	adv.	again; back	이거 도로 가져 가라.	Take this back.	32 | 0.65
3800	감옥		gamok	n.	jail, prison	그는 2년을 감옥에서 보냈다.	He spent two years in a prison.	32 | 0.99
3801	포		po	n.	cannon, artillery	우리 군도 포를 쏠 준비를 하고 있었어.	Our military was ready to fire a cannon.	32 | 0.80
3802	씌우다		ssuiuda	v.	cover	그들은 피아노 위에 천을 씌워 놓았다.	They put a cover on the piano.	32 | 0.80
3803	어리석다		eoriseokda	a.	foolish, stupid	제가 어리석었습니다.	I was stupid.	32 | 0.96
3804	치열하다		chiyeolhada	a.	fierce, intense	전쟁은 치열했다.	The war was fierce.	32 | 0.87
3805	추		chu	n.	pendulum	사람들은 시계 추처럼 바쁘게 움직인다.	People move fast like the pendulum of a clock.	32 | 0.69
3806	거짓		geojit	n.	lie, falsehood	그가 말한 것은 모두 거짓입니다.	What he said is all a lie.	32 | 0.98
3807	트럭		teureok	n.	truck	친구가 트럭을 몰았다.	A friend drove a truck.	32 | 0.91
3808	화해		hwahae	n.	reconciliation	양국은 화해를 꾀했다.	The two countries tried to reconcile.	32 | 0.90
3809	국방		gukbang	n.	national defense	국방의 의무는 대단히 중요하지.	The duty of national defense is very important.	32 | 0.72
3810	국		guk	n.	soup	국이 아주 맛있어요.	The soup is really delicious.	32 | 0.80
3811	열차		yeolcha	n.	train	열차 안은 깨끗했다.	The train interior was clean.	32 | 0.96
3812	성	2	seong	n.	castle, fortress	그건 유럽의 성 같았어.	It looked like a European castle.	32 | 0.84
3813	강아지		gangaji	n.	puppy	강아지가 아주 귀여워.	The puppy is very cute.	32 | 0.79
3814	장점		jangjeom	n.	merit, advantage	네 장점은 뭐니?	What are your merits?	32 | 0.86
3815	도덕적		dodeokjeok	n.	ethical, moral	누구에게 도덕적 책임이 있나요?	Who has the ethical responsibility?	32 | 0.86
3816	추억		chueok	n.	memory, remembrance	친구와 놀던 추억이 생각나네요.	It brings back memories of when I played with friends.	32 | 0.99
3817	불가피하다		bulgapihada	a.	inevitable	파업은 불가피한 것으로 보인다.	The strike seems to be inevitable.	32 | 0.79
3818	민속		minsok	n.	folk	안내인은 민속 의상을 입고 있었다.	The guide wore a folk costume.	32 | 0.83
3819	로비		robi	n.	lobby	나는 로비에서 그를 기다렸지.	I waited for him at the lobby.	32 | 0.74
3820	이해되다		ihaedoeda	v.	be understood	제가 하는 말이 그들에게 이해될까요?	Is what I say understood by them?	32 | 0.80
3821	첫날		cheonnal	n.	first day	출근 첫날부터 난 바빴어.	I was busy from the first day at work.	32 | 0.78
3822	구먼		gumeon	e.	FINAL, STATEMENT	이거 큰 문제구먼.	This is a big problem.	31 | 0.67
3823	가두다		gaduda	v.	lock up, confine	농부는 돼지를 가두었다.	The farmer locked up a pig.	31 | 0.76
3824	우산		usan	n.	umbrella	우산이 예쁘네요.	Your umbrella is pretty.	31 | 0.83
3825	고문		gomun	n.	torture	당시 고문 사건도 있었다.	At that time, there was also a torture case.	31 | 0.97
3826	생존		saengjon	n.	survival	생존을 위한 방식들은 종마다 다르다.	The methods of survival are different among species.	31 | 0.91
3827	독재		dokjae	n.	dictatorship, tyranny	군부 독재가 마침내 끝났다.	The military dictatorship finally ended.	31 | 0.93
3828	라니/으라니	2	rani/eurani	e.	FINAL, SURPRISE	도대체 왜 나보고 포기하라니?	Why are they asking me to give up?	31 | 0.74
3829	선비		seonbi	n.	classical scholar	우리는 대대로 선비 집안이라구.	We are a family of generations of classical scholars.	31 | 0.76
3830	대한민국		daehanminguk	n.	Korea	우리는 ‘대한민국’을 같이 외쳤다.	We shouted ‘Korea’ together.	31 | 0.89
3831	건드리다		geondeurida	v.	touch; get on	나는 아기의 코끝을 살짝 건드렸다.	I touched the tip of the baby’s nose.	31 | 0.84
3832	간장		ganjang	n.	soy sauce	간장이 아주 맛있네.	Soy sauce is very tasty.	31 | 0.75
3833	파일		pail	n.	file	파일이 분실되었어.	The file was lost.	31 | 0.84
3834	적용되다		jeogyongdoeda	v.	apply	법이 적용되는 절차가 매우 중요하지.	The procedures that the laws are applied to are very important.	31 | 0.81
3835	탄생		tansaeng	n.	birth	모두가 아기의 탄생을 축하해 주었어요.	Everyone celebrated the birth of the baby.	31 | 0.88
3836	함		ham	n.	box, case	제가 편지를 함에 넣어 두었어요.	I put the letter in a box.	31 | 0.73
3837	창조		changjo	n.	creation	그는 언제나 예술적 창조에 대해 생각한다.	He always thinks of artistic creations.	31 | 0.82
