2422	더하다		deohada	v.	increase, add	주인은 보너스까지 더해 주었다.	The owner even added a bonus.	58 | 0.99
2423	폭력		pongnyeok	n.	violence	모두가 폭력에 맞서 싸워야 해요.	Everyone should fight against violence.	58 | 0.91
2424	능		neung	n.	royal tomb	이건 조선 시대 왕비의 능이야.	This is a royal tomb of a queen of the Joseon period.	58 | 0.50
2425	사위		sawi	n.	son-in-law	어느 날 사위가 전화를 했어.	One day the son-in-law called.	58 | 0.58
2426	베다		beda	v.	cut, fell	옛날에는 나무를 허가 없이 벨 수 있었다	In the old days, we could cut trees without permission.	58 | 0.74
2427	그만두다		geumanduda	v.	stop, quit, cease	현우는 직장을 그만두었다.	Hyunwu quit the job.	58 | 0.91
2428	이동		idong	n.	movement, migration	이동 경로를 조사해 보기로 합시다.	Let’s examine the route of migration.	58 | 0.89
2429	대사	2	daesa	n.	line, dialog, speech	배우가 대사를 잊어버렸다.	The actor forgot the line.	58 | 0.65
2430	추구하다		chuguhada	v.	pursue, seek	인간은 진리를 추구한다.	Humans seek the truth.	58 | 0.87
2431	강력하다		gangnyeokada	a.	strong, powerful	차의 엔진이 아주 강력하군요.	The car engine is very powerful.	58 | 0.89
2432	한두		handu	adn.	one or two	한두 명은 꼭 첫날 지각을 하지.	One or two students always come late on the first day.	58 | 0.93
2433	사회주의		sahoejuui	n.	Socialism	사회주의에 대한 이해가 부족해.	An understanding of socialism is lacking.	58 | 0.84
2434	감각		gamgak	n.	sense	몸의 감각이 사라졌다.	All of my senses became numb.	58 | 0.95
2435	어머		eomeo	exc.	oh, oh my	어머, 오랜만이에요.	Oh, it’s been a while.	58 | 0.37
2436	정당		jeongdang	n.	political party	그는 어느 정당에도 속하지 않았지.	He didn’t belong to any political party.	58 | 0.78
2437	개발하다		gaebalhada	v.	develop, exploit	신기술을 개발했다.	We developed a new technology.	58 | 0.78
2438	얹다		eonda	v.	put on, place, lay	머리에 손을 얹어 보세요.	Try to put your hand on your head.	58 | 0.78
2439	더럽다		deoreopda	a.	dirty, filthy; awful, terrible	밖에서 뛰어다닌 강아지는 너무 더러웠어.	The puppy running around outside was s. dirty.	58 | 0.79
2440	충분하다		chungbunhada	a.	enough, sufficient	이만큼이면 충분해요.	With this much, it’s enough.	58 | 0.97
2441	틀림없다		teullimeopda	a.	certain, sure	얘는 오늘 지각이 틀림없어.	This kid is sure to be late today.	58 | 0.95
2442	불안		buran	n.	anxiety, apprehension	마음이 불안해요.	I feel anxious.	58 | 0.97
2443	승		seung	n.b.	COUNTER (winning)	지금까지 몇 승을 하신 거지요?	How many times have you won s. far?	58 | 0.76
2444	굶다		gumda	v.	starve, fast	하루 종일 굶었어요.	I starved all day.	58 | 0.67
2445	연결		yeongyeol	n.	link, connection	네트워크 연결이 좋지 않네.	The network connection is not good.	58 | 0.85
2446	건강하다		geonganghada	a.	healthy	할머니께서는 건강하십니까?	Is your grandmother healthy?	58 | 0.94
2447	날씨		nalssi	n.	weather	오늘의 날씨를 말씀드리겠습니다.	I’ll report today’s weather.	58 | 0.96
2448	쌍		ssang	n.	pair, couple	오늘 젊은 쌍들이 콘서트에 많이 오셨군요.	Many young couples have come to the concert today.	58 | 0.69
2449	느라		neura	e.	CONNECTIVE, while, as	일하느라 가 볼 시간이 없었어.	While working, I never had the time to go.	57 | 0.93
2450	재판		jaepan	n.	trial	재판 일정이 잡혔어.	The trial schedule has been set up.	57 | 0.94
2451	음성		eumseong	n.	voice	음성 메시지를 남기셨어요?	Did you leave a voice message?	57 | 0.93
2452	식당		sikdang	n.	restaurant	지민이는 식당을 운영해.	Jimin runs a restaurant.	57 | 0.98
2453	극복하다		geukbokada	v.	overcome	저 가수는 암을 극복했다.	That singer overcame cancer.	57 | 0.89
2454	강화		ganghwa	n.	reinforcement, consolidation	일부 의원들은 규제 강화를 주장했다.	Some members argued for reinforcement of the regulations.	57 | 0.82
2455	흔들리다		heundeullida	v.	shake, wave	차가 심하게 흔들렸다.	The car shook s. much.	57 | 0.96
2456	어미		eomi	n.	mother (animals)	새끼 곰들은 어미를 기다린다.	The cubs are waiting for their mother.	57 | 0.88
2457	한글		hangeul	n.	Hangeul	걔는 세 살 때 한글을 혼자 배웠어.	He learned Hangeul on his own when he was three.	57 | 0.82
2458	답니다		damnida	e.	FINAL, QUOT.	저희 가족은 모두 건강하답니다.	My family are all healthy.	57 | 0.67
2459	불법		bulbeop	n.	illegality	불법 수술이 때로 이루어진다.	Illegal surgeries are done sometimes.	57 | 0.76
2460	자격		jagyeok	n.	qualification, right	그는 모든 자격을 갖추고 있다구요.	He has all the qualifications.	57 | 0.93
2461	입히다		ipida	v.	dress, put … on; coat; cause	아기에게 옷을 입혔어요.	I dressed the baby.	57 | 0.75
2462	발전하다		baljeonhada	v.	develop, progress	학교가 날로 발전하고 있다.	The school is progressing every day.	57 | 0.86
2463	의혹		uihok	n.	doubt, suspicion	그들의 행동은 의혹을 불러일으켰다.	Their behaviors raised suspicion.	57 | 0.63
2464	반장		banjang	n.	president (of class), chief	선생님이 나한테 반장을 시켰어.	The teacher made me the class president.	57 | 0.70
2465	애	2	ae	n.	state of being anxious, troubles	기다리던 사람들은 애가 탔다.	People who were waiting were anxious.	57 | 0.75
2466	소리치다		sorichida	v.	shout	아이들이 소리쳤어요.	The children shouted.	57 | 0.74
2467	텔레비전		tellebijeon	n.	television	저 남자는 텔레비전에서 보던 사람이야.	That man is the person I used to see on TV.	57 | 0.97
2468	갈다	1	galda	v.	change, replace	타이어를 갈아야겠어요.	I need to change the tire.	57 | 0.59
2469	작용		jagyong	n.	action; effect	기계의 작용이 단순해.	The effect of the machine is simple.	57 | 0.78
2470	부끄럽다		bukkeureopda	a.	ashamed, embarrassed	저는 제 자신이 부끄럽습니다.	I’m ashamed of myself.	57 | 0.94
2471	양	2	yang	adn.	both	천의 양 끝을 잡으세요.	Please hold the two edges of the cloth.	57 | 0.90
2472	길래		gillae	e.	CONNECTIVE, since, as	누가 앉아있길래 다른 쪽으로 갔다.	Since there was someone sitting there, I moved to another side.	57 | 0.55
2473	뒤집다		dwijipda	v.	turn … over; turn … inside out; overturn	손바닥을 뒤집어 봐.	Turn your hand over.	57 | 0.80
2474	배우		baeu	n.	actor, actress	지훈은 배우가 되길 원해.	Jihun wants to be an actor.	57 | 0.89
2475	지시		jisi	n.	instruction, direction	그건 사장님 지시였다.	It was the CEO’s instruction.	57 | 0.98
2476	절대로		jeoldaero	adv.	never	절대로 약속을 어기면 안 됩니다.	You should never break a promise.	57 | 0.89
2477	순서		sunseo	n.	order	일은 순서대로 진행해야 해.	The work needs to proceed in order.	57 | 0.88
2478	구만		guman	e.	FINAL, STATEMENT	이 사람 냉정하구만.	This person is cold.	57 | 0.53
2479	비디오		bidio	n.	video	그건 비디오 영화였어.	It was a video.	57 | 0.83
2480	만화		manhwa	n.	comic book, cartoon	요즘은 만화 작가들이 많지.	These days there are many comic book writers.	57 | 0.88
2481	소득		sodeuk	n.	income, gain	평균 소득이 얼마나 될까?	How much will the average income be?	57 | 0.82
2482	다음날		daeumnal	n.	following day	다음날은 날씨가 흐렸다.	On the following day, it was cloudy.	57 | 0.97
2483	재정		jaejeong	n.	finance	재정 상황이 나아졌어요.	The financial situation improved.	56 | 0.77
2484	벌	1	beol	n.	punishment, penalty	형이 방에서 벌을 받고 있어요.	My older brother is getting his punishment in the room.	56 | 0.73
2485	동무		dongmu	n.	companion, friend	어린 시절 동무들이 그리워요.	I miss my childhood friends.	56 | 0.70
2486	공주		gongju	n.	princess	옛날에 공주가 한 명 살았어.	In the old days, there was a princess.	56 | 0.74
2487	기쁘다		gippeuda	a.	pleased; pleasant	다시 만나서 기쁩니다.	I’m pleased to meet you again.	56 | 0.93
2488	연대		yeondae	n.	solidarity, banding together	학생들은 연대 의식이 강했다.	Students had a strong sense of solidarity.	56 | 0.84
2489	나르다		nareuda	v.	carry	짐을 나르는 사람이 누구예요?	Who is that carrying the luggage?	56 | 0.67
2490	두드리다		dudeurida	v.	knock, beat, tap	누군가 문을 두들기고 있어요.	Someone’s knocking at the door.	56 | 0.81
2491	착하다		chakhada	a.	be good	애들은 참 착해요.	The children are very good.	56 | 0.79
2492	문명		munmyeong	n.	civilization	문명의 발달은 인간의 삶을 풍요롭게 해 왔지.	The development of civilization has enriched human life.	56 | 0.85
2493	자원		jawon	n.	resource	자연 자원을 아껴야 합니다.	We should save natural resources.	56 | 0.82
2494	신체		sinche	n.	physical body	그 청년 신체가 아주 건장했어.	The young man had a strong body.	56 | 0.87
2495	무시하다		musihada	v.	ignore	제 말을 왜 무시하세요?	Why do you ignore what I say?	56 | 0.98
2496	옥		ok	n.	jade	나는 옥으로 된 반지를 샀다.	I bought a ring made of jade.	56 | 0.66
2497	양	3	yang	n.b.	pretense; intention	서연이는 화가 난 양 그에게 말을 안 했다.	Seoyeon pretended to be angry and did not talk to him.	56 | 0.91
2498	ㅁ에도/음에도		medo/eumedo	e.	CONNECTIVE, in spite of	가족이 반대함에도 불구하고 서울로 왔지.	I came to Seoul despite my family’s opposition.	56 | 0.96
2499	달래다		dallaeda	v.	soothe, comfort; coax	어머니는 밤새 우는 아기를 달래셨지.	Mother soothed the crying baby all night.	56 | 0.85
2500	무조건		mujogeon	adv.	unconditional	무조건 네가 옳다고 우기지 마.	Do not argue that you are unconditionally right.	56 | 0.80
2501	건네다		geonneda	v.	pass; speak to	소년은 소녀에게 말을 건넸다.	A boy spoke to a girl.	56 | 0.75
2502	일제히		iljehi	adv.	all together, simultaneously, all at once	아이들은 일제히 소리를 질렀어.	The children all screamed together.	56 | 0.71
2503	오직		ojik	adv.	only	엄마는 오직 너만을 생각한단다.	Mommy thinks only of you.	56 | 0.96
2504	똑같이		ttokgachi	adv.	same way; equally, evenly	아버지와 아들이 똑같이 부지런해.	Both father and son are equally diligent.	56 | 0.73
2505	정신적		jeongsinjeok	n.	mental, psychological	정신적 노동이 육체적 노동보다 힘든 경우도 있지.	Mental labor is sometimes harder than physical labor.	56 | 0.92
2506	다가가다		dagagada	v.	approach	현우는 아이에게 다가갔다.	Hyunwu approached the child.	56 | 0.81
2507	대접		daejeop	n.	reception, treatment	우리는 그들에게서 극진한 대접을 받았어.	We received a cordial reception from them.	56 | 0.72
2508	낫다	2	natda	v.	get better, recover	몸이 좀 낫기를 바랍니다.	I hope you will get better.	56 | 0.52
2509	가사		gasa	n.	lyrics	노래 가사가 아주 낭만적이구나.	The lyrics of the song are very romantic.	56 | 0.77
2510	랴/으랴	1	rya/eurya	e.	FINAL, QUESTION	누가 너를 비난하랴.	Who can criticize you?	56 | 0.74
2511	범위		beomwi	n.	range	수치가 정상 범위에서 벗어나 있다.	The number is over the normal range.	56 | 0.86
2512	도	4	do	n.	right way, enlightenment	우리는 도에 따라서 삽시다.	Let’s follow the right way while living.	55 | 0.83
2513	사실상		sasilsang	n.	in fact	사실상, 이번 프로젝트는 실패야.	In fact, this project is a failure.	55 | 0.83
2514	내다보다		naedaboda	v.	look out; predict	어머니께서는 창 밖을 내다보고 계셨다.	My mother was looking out through the window.	55 | 0.91
2515	오른쪽		oreunjjok	n.	right	오른쪽으로 도세요.	Turn to the right.	55 | 0.97
2516	연기	1	yeongi	n.	performance, acting	배우의 연기가 정말 뛰어났어.	The actor’s performance was really outstanding.	55 | 0.84
2517	아니하다		anihada	aux.	do not; be not	난 대답하지 아니할 겁니다.	I won’t answer.	55 | 0.89
2518	하여금		hayeogeum	adv.	(drive someone) to, by . . .	그 책은 독자로 하여금 많은 생각을 하게 한다.	That book makes the reader think a lot.	55 | 0.91
2519	유지		yuji	n.	maintenance	지민이는 몸매 유지를 잘 해.	Jimin is good at body maintenance.	55 | 0.88
2520	피부		pibu	n.	skin	피부가 정말 부드럽구나.	The skin is really smooth.	55 | 0.95
2521	아우		au	n.	younger sibling	아우가 몇 명인가?	How many younger siblings do you have?	55 | 0.61
2522	서구		seogu	n.	(the) West	젊은 세대는 서구의 문화를 적극 수용한다.	The young generation actively accepts Western culture.	55 | 0.78
2523	지우다		jiuda	v.	erase, wipe, delete	선생님은 칠판을 깨끗이 지웠습니다.	The teacher wiped the blackboard clean.	55 | 0.93
2524	편	3	pyeon	n.	side, direction	상대를 네 편으로 만들어야 해.	You need to make the other one take your side.	55 | 0.93
2525	길이		giri	n.	length	치마 길이가 너무 짧지 않아?	Isn’t the skirt too short?	55 | 0.93
2526	이사	2	isa	n.	moving	이사 준비는 항상 힘들어.	Moving preparations are always hard.	55 | 0.79
2527	강의		gangui	n.	lecture, course, class	이달 말에 강의가 끝나요.	The course finishes at the end of this month.	55 | 0.86
2528	유일하다		yuilhada	a.	only, sole	그 영화가 제가 본 유일한 영화랍니다.	That movie is the only one I saw.	55 | 0.98
2529	거울		geoul	n.	mirror	거울에 비친 내가 너무 창백해 보이네.	I look s. pale in the mirror.	55 | 0.90
2530	에너지		eneoji	n.	energy	에너지를 낭비해서는 안 된다.	We should not waste energy.	55 | 0.86
2531	수십		susip	num.	scores, dozens	수십 명의 학생들이 강의실로 들어왔다.	Dozens of students entered the classroom.	55 | 0.94
2532	다	4	da	n.	all; almost	다 떠나갔어요.	All of them left.	55 | 0.52
2533	독		dok	n.	poison	그건 독이 든 사과였어.	It was a poison apple.	55 | 0.66
2534	남	3	nam	n.	south	그 이후 한반도는 남과 북으로 나뉘었다.	Since then, the Korean peninsula has been divided into the South and the North.	55 | 0.75
2535	시어머니		sieomeoni	n.	mother-in-law	시어머니께서 오신다.	My mother-in-law is coming.	55 | 0.66
2536	무	2	mu	n.	nothing, zero, naught	무에서 유를 창조할 수도 있어.	It’s possible to create something from nothing.	55 | 0.72
2537	과부		gwabu	n.	widow	어린 나이에 그녀는 과부가 되었다.	She became a widow at a young age.	55 | 0.55
2538	장단		jangdan	n.	beat, rhythm	배우는 전통적 장단에 맞춰 춤을 췄다.	The actress followed the traditional rhythm as she danced.	55 | 0.47
2539	아까	2	akka	n.	a while ago	아까 말씀드렸잖아요.	I told you a while ago.	55 | 0.56
2540	활		hwal	n.	bow	옛날에는 활을 쏘았지.	In the old days, we bowed.	55 | 0.59
2541	민요		minyo	n.	folk song	우리는 민요를 즐겨 부른다.	We frequently sing folk songs.	55 | 0.58
2542	자세히		jasehi	adv.	in detail, minutely	비서가 서류를 자세히 검토했다.	My secretary examined the document in detail.	55 | 0.94
2543	검토하다		geomtohada	v.	examine, look over	먼저 서류를 자세히 검토해 보세요.	First examine the documents in detail.	55 | 0.83
2544	장애		jangae	n.	obstacle, hindrance; disability	그는 여러 장애를 극복하고 실험에 성공했다.	He succeeded with the experiment by overcoming many obstacles.	55 | 0.85
2545	저리		jeori	adv.	that way, over there	저리 가세요.	Go over there.	55 | 0.46
2546	리라고/으리라고		rirago/eurirago	e.	CONNECTIVE, to	다음에는 절대 안 그러리라고 다짐했어.	I resolved not to do that again.	55 | 0.94
2547	담기다		damgida	v.	be contained	편지에는 아버지 마음이 담겼다.	My father’s mind is reflected in this letter.	55 | 0.99
2548	의회		uihoe	n.	assembly, parliament	의회 모임이 있습니다.	There is an assembly meeting.	55 | 0.69
2549	일주일		iljuil	n.	one week	지난 일주일 동안 뭐 하셨어요?	What did you do over the past week?	55 | 0.75
2550	관광		gwangwang	n.	sightseeing	우리는 시내 관광을 마쳤다.	We finished sightseeing downtown.	54 | 0.82
2551	쉬다	2	swida	v.	breathe	숨을 깊이 쉬세요.	Breathe deeply.	54 | 0.86
2552	근	1	geun	adn.	about	떠난 지 근 한 시간이 지났네.	It’s been about an hour since we left.	54 | 0.50
2553	깨다	2	kkaeda	v.	break, smash, spoil	아이가 유리잔을 깼어.	A child broke a glass.	54 | 0.79
2554	범죄		beomjoe	n.	crime	범죄를 예방합시다.	Let’s prevent crime.	54 | 0.88
2555	포함되다		pohamdoeda	v.	be included	계산서에 세금이 포함되어 있나요?	Has the tax been included in the bill?	54 | 0.86
2556	굵다		gukda	a.	thick, big, bold	연필이 너무 굵어요.	The pencil is too thick.	54 | 0.79
2557	높이	1	nopi	adv.	high	높이 나는 새가 멀리 본다.	A bird that’s flying high can see far.	54 | 0.95
2558	경쟁력		gyeongjaengnyeok	n.	competitiveness	제품이 경쟁력이 있다.	The product is competitive.	54 | 0.70
2559	동료		dongnyo	n.	colleague	동료가 도움이 많이 돼요.	My colleagues are very helpful.	54 | 0.98
2560	미술		misul	n.	art	전 미술을 전공하고 싶습니다.	I would like to major in art.	54 | 0.89
2561	대형		daehyeong	n.	large size	대형 백화점이 문을 열었다.	A large-size department store opened.	54 | 0.75
2562	박수		baksu	n.	applause, ovation	모두가 그녀에게 큰 박수를 보냈다.	Everyone gave her a big round of applause.	54 | 0.73
2563	날다		nalda	v.	fly	하늘에 독수리가 날고 있어요.	There is an eagle flying in the sky.	54 | 0.80
2564	불편하다		bulpyeonhada	a.	inconvenient; uncomfortable	할머니는 좀 불편해 보이셨어.	Grandmother looked somewhat uncomfortable.	54 | 0.90
2565	인상	1	insang	n.	impression	그림이 인상에 깊이 남았다.	The picture left a strong impression.	54 | 0.97
2566	상	3	sang	n.	table	상이 잘 차려졌어요.	The table has been well made.	54 | 0.65
2567	의문		uimun	n.	question, doubt	의문이 있으십니까?	Do you have any questions?	54 | 0.97
2568	아무튼		amuteun	adv.	in any case, anyway, at any rate	아무튼 나는 이해가 안 돼.	At any rate, I don’t understand it.	54 | 0.74
2569	빨갛다		ppalgatda	a.	red, crimson	얼굴이 빨갛게 변했어요.	Your face turned red.	54 | 0.82
2570	지혜		jihye	n.	wisdom	신에게 지혜를 달라고 기도했지요.	I prayed to God to give me wisdom.	54 | 0.98
2571	건축		geonchuk	n.	construction	민준은 대학 때 건축을 전공했어.	Minjun majored in architecture at college.	54 | 0.86
2572	의무		uimu	n.	duty	모두가 법을 지킬 의무가 있지.	Everyone has a duty to obey the law.	54 | 0.93
2573	신분		sinbun	n.	status, identity	신분이 불확실해.	The status is unclear.	54 | 0.94
2574	침묵		chimmuk	n.	silence	침묵은 금이라고 합니다.	They say that silence is golden.	54 | 0.91
2575	부탁하다		butakada	v.	request, ask	부탁할 게 있어서 전화를 드렸어요.	I called you because I have something to request.	54 | 0.90
2576	점수		jeomsu	n.	score, grade	시험 점수가 좋구나!	The exam score is good!	54 | 0.75
2577	방학		banghak	n.	vacation, break	이제 곧 방학이야.	It will be vacation soon.	54 | 0.88
2578	비교적		bigyojeok	n.	comparatively, relatively	시험이 비교적 쉬웠어.	The exam is comparatively easy.	54 | 0.93
2579	임시		imsi	n.	temporary, provisional	임시 대피소가 설치되었다.	A temporary shelter has been installed.	54 | 0.93
2580	원수		wonsu	n.	enemy, foe	그들은 원수같이 싸웠다.	They fought like enemies.	54 | 0.68
2581	엿		yeot	n.	stick of taffy	시험 날 어머니께서 엿을 사 오셨어.	On exam day, my mother bought sticks of taffy for me.	54 | 0.46
2582	전부	2	jeonbu	n.	all	그는 재산 전부를 재단에 기부했다.	He donated all of his fortune to the foundation.	54 | 0.87
2583	누리다		nurida	v.	enjoy	건강한 삶을 누리세요.	Enjoy a healthy life.	54 | 0.97
2584	차량		charyang	n.	car, vehicle	경찰이 차량을 검사했다.	The police inspected the car.	54 | 0.80
2585	세금		segeum	n.	tax, duty	세금을 내는 건 국민된 도리지.	Paying taxes is the duty of citizens.	54 | 0.82
2586	확		hwak	adv.	with a great puff; with a flame; suddenly, in a flash	나는 문을 확 밀었어.	I suddenly pushed the door open.	54 | 0.53
2587	줄어들다		jureodeulda	v.	decrease	마을 인구가 줄어들고 있어.	The population of the village is decreasing.	54 | 0.85
2588	근대		geundae	n.	modern times (era)	이 개념은 근대에 나왔어.	This concept appeared in modern times.	54 | 0.75
2589	꼬리		kkori	n.	tail	강아지가 꼬리를 흔든다.	A puppy is wagging its tail.	54 | 0.86
2590	궁		gung	n.	palace	궁에서 자주 파티가 열렸다.	Parties were held often at the palace.	54 | 0.55
2591	맥		maek	n.	pulse, energy; legacy	의사가 환자의 맥을 짚었다.	The doctor took the patient’s pulse.	54 | 0.85
2592	웬일		wennil	n.	for what reason, what	네가 웬일로 전화했니?	What made you call me?	54 | 0.64
2593	인력		illyeok	n.	manpower	인력을 동원하기로 했다.	We have decided to mobilize the work force.	54 | 0.78
2594	세다	1	seda	a.	strong, powerful; stubborn	아이가 힘이 세네.	The child is strong.	54 | 0.75
2595	출발하다		chulbalhada	v.	depart, leave	기차가 출발했다.	The train departed.	54 | 0.98
2596	바보		babo	n.	idiot, fool	난 정말 바보 같았어.	I was really like a fool.	54 | 0.77
2597	현지		hyeonji	n.	on-the-spot, local	그도 현지 사람이 아니었다.	He was not a local person.	54 | 0.76
2598	확보하다		hwakbohada	v.	secure	자재를 먼저 확보해야 해.	You should have secured the materials.	54 | 0.85
2599	점차		jeomcha	adv.	gradually	기차 소리는 점차 멀어져 갔어요.	The sound of the train disappeared gradually.	53 | 0.91
2600	저지르다		jeojireuda	v.	commit	범인은 끔찍한 범죄를 저질렀다.	The criminal committed a horrible crime.	53 | 0.98
2601	모자		moja	n.	hat, cap	민서는 모자를 썼다.	Minseo wears a hat.	53 | 0.78
2602	신부	1	sinbu	n.	bride	웨딩드레스를 입은 신부가 입장했다.	A bride in a wedding dress entered.	53 | 0.81
2603	지붕		jibung	n.	roof	지붕 위에 새가 한 마리 앉아 있어.	A bird is sitting on the roof.	53 | 0.86
2604	젓다		jeotda	v.	stir; roll; wave	지민이는 커피에 설탕을 넣고 저었다.	Jimin put sugar in the coffee and stirred it.	53 | 0.75
2605	대학원		daehagwon	n.	graduate school	졸업 후 대학원에 갈 생각이야.	I am thinking of going to graduate school after graduation.	53 | 0.73
2606	기차		gicha	n.	train	기차가 역으로 들어옵니다.	The train enters the station.	53 | 0.87
2607	남한		namhan	n.	South Korea	이번 게임은 남한에서 있을 겁니다.	This game will be in South Korea.	53 | 0.90
2608	그리하여		geurihayeo	conj.	therefore, so	그리하여 일은 마무리되었다.	Therefore, the work has been finished.	53 | 0.78
2609	망		mang	n.	net, network	인터넷망은 놀라운 속도로 늘어났다.	The Internet network expanded at an amazing speed.	53 | 0.77
2610	널리		neolli	adv.	far and wide, extensively	선생의 공적을 널리 알려야 합니다.	We should publicize the teacher’s achievement extensively.	53 | 0.88
2611	테이프		teipeu	n.	tape	녹음한 테이프가 없어졌어요.	The recorded tape was lost.	53 | 0.69
2612	검사	2	geomsa	n.	prosecutor, district attorney	검사는 피고에게 무기징역을 구형했습니다.	The prosecutor demanded lifetime imprisonment.	53 | 0.83
2613	돌아다니다		doradanida	v.	go around	여기저기 돌아다니면서 노래를 했어.	I sang a song while I traveled everywhere.	53 | 0.84
2614	한강		hangang	n.	Han River	그는 한강 근처에 살아.	He lives near the Han River.	53 | 0.87
2615	날리다		nallida	v.	fly, blow away; distinguish oneself	밖에 연을 날리는 아이들이 보이네요.	I see children flying kites outside.	53 | 0.93
2616	증권		jeunggwon	n.	stock	나는 증권에 투자했다.	I invested in the stock.	53 | 0.65
2617	보고서		bogoseo	n.	report	연구원들은 보고서를 제출합니다.	Researchers submit reports.	53 | 0.80
2618	파업		paeop	n.	strike	노조는 파업을 시행했다.	The labor union proceeded with the strike.	53 | 0.81
2619	그럼	2	geureom	exc.	yes, indeed; if so, then	그럼, 이건 어때요?	Then, what about this?	53 | 0.44
2620	지위		jiwi	n.	status	네 지위가 높아졌구나.	Your status rose.	53 | 0.87
2621	글씨		geulssi	n.	handwriting; letter, character	글씨가 정말 예쁩니다.	The handwriting is really beautiful.	53 | 0.84
2622	수원		suwon	n.	Suwon (city name)	그는 수원에서 태어났어.	He was born in Suwon.	53 | 0.71
2623	대체로		daechero	adv.	overall, generally	오늘은 대체로 흐리겠습니다.	Today it will be cloudy overall.	53 | 0.86
2624	구성되다		guseongdoeda	v.	be made up, be composed	위원회는 주민 대표들로 구성되었다.	The committee was composed of resident representatives.	53 | 0.75
2625	철저하다		cheoljeohada	a.	complete	보안이 철저해.	Security is complete.	53 | 0.97
2626	유형		yuhyeong	n.	type	다양한 유형의 디자인이 나왔다.	Various types of designs were submitted to the contest.	53 | 0.79
2627	심지어		simjieo	adv.	even	심지어 나도 못 믿겠더라구.	Even I couldn’t believe it.	53 | 0.98
2628	조그맣다		jogeumatda	a.	small, little	조그마한 아기의 손이 너무 신기했어요.	The baby’s small hands were s. wondrous.	53 | 0.89
